REVIEW_ID,MEMBER_ID,Reviews,sentiment_label
a2p4w000001prS8AAI,0011U00000rilewQAA,good interpersonal relations  enough time spent with me appt  started late  which in this case was not a big deal ,Negative
a2p4w000002O4TfAAK,0011U00000rjx2JQAQ,never have to wait  excellent customer rapport  i love my doctor ,Negative
a2p4w000002OBaTAAW,0014w00003GFT2OAAX,the staff of two was outstanding and seamlessly working together you need to hire a front desk person so the nurse can be a nurse   you are missing calls when she is with patients and creating double work for the staff and the potential patients trying to get an appointment ,Negative
a2p4w000002O4IcAAK,0014w000031rNV2AAM,i was very please with this visitvery caring  and compassionate  and understanding na,Negative
a2p4w000002OCgIAAW,0014w00003GHMOJAA5,i was unable to have my virtual appointment yesterday  because i was unable to create a profile   dr  smith and her staff always listens to me ,Negative
a2p4w000002ODQaAAO,0013g000007ZZZFAA4,sometimes it takes too long to be able to see your own doctor and you have to be jumping to anothertalking to the doctor about my sicknessdoctor confuse with the instructions of medication  at the visit he told me to take one pill a day for back pain and when i pick pick up medication instructions said   times a day,Negative
a2p4w000002NyrgAAC,0014w00002pQMfSAAW,brett is always so pleasant and helpful    he always acknowledges you when enter the office    during these difficult times that greeting is so appreciated ,Negative
a2p3g000000qpahAAA,0011U00000riS1FQAU,timeliness  friendliness  cleanliness  helpful not that is was not well  it is just that this was my initial appointment which was originally scheduled for a televisit   i switched it to in person and offered to reschedule  i was told no that i could keep same appt   when dr peiffer came in she said she wanted to apologize if things felt a little rushed as normally she has almost double the time for an initial visit   i did not feel rushed but was frustrated to know i had asked and offered to reschedule to a new date when talking with scheduling ,Negative
a2p4w000002NzQWAA0,0014w00002pQDBwAAO,everytime i see rachel vreeland  i feel heard and respected  she is easy to talk to  and truly listens to my concerns   the nursing staff is awesome  as well  jodi is efficient and friendly  she is also a pro at taking blood from me  something that has never been easy for other providers ,Negative
a2p4w000002OB6xAAG,0014w000031fxe8AAA,very polite  and was not in a rush for me to leave for the next patient ,Negative
a2p4w000002JmvYAAS,0011U00000rj7oQQAQ,if i don     t want treatment for a condition  i shouldn     t be forced to endure long speeches and threats ,Negative
a2p4w000002O4YkAAK,0013g000003rbsIAAQ,dr curtis is a good listener he makes difficult conversations easy i so appreciate himnothing,Negative
a2p4w000002Nzv5AAC,0014w00002pQ9ltAAC,overall smooth and the wait wasn rsquo t too long ,Negative
a2p4w000001psSEAAY,0013g0000065me3AAA,pleasent experience   nice staffhonest   upfront,Negative
a2p4w000002O3hvAAC,0014w00002pQC86AAG,my appointment took entirely too long and the staff was unpreparedtime management  i also had to go back to get my prescription because it wasn rsquo t either given to me or filled at they on location pharmacy,Negative
a2p4w000002O3DHAA0,0014w000031qg0XAAQ,your staff is always helpful and courteous if there is con it would just be that my tests and blood work was not sent to dr schuster like i had requested  she was still able to complete my visit and gain access later ,Negative
a2p4w000002ODpkAAG,0014w00003GE3z2AAD,i like the office staff and provider at my location the emr was non functional during my visit  which is no surprise given that it s ecw  and the staff was able to work through it without becoming overstressed about it used eclinicalworks as an emr   you know they were fined for falsifying meaningful use data  right ,Negative
a2p4w000002ODTZAA4,0013g000007ZZCVAA4,i liked the hours of availability the doctor listened to all my concerns and addressed them with care the assistant drawing blood for my lab work failed twice  she was unable to get a blood sample from the first arm  tried again on the second arm and was still unable to get a blood sample  i then had to leave with sore arms and then reschedule  now i have to come back again at another time which defeats the purpose in an all in one visit ,Negative
a2p4w000002O5zcAAC,0014w00003GEHohAAH,no long wait  friendly staffthe doctor took the time to listen carefully and responded to all my questionsi had to remind the nurse of my weight once we got into the room   it was not recorded when it was taken ,Negative
a2p4w000002O5bkAAC,0014w00003GEAhwAAH,i waited about    minutes before appointment when knowing that i had done the pre enrollment by phone  in addition  the nurse that i was supposed to see left because it was the end of her shift    although my appointment was on her schedule  once i saw the technician for the screening  i waited under    min    anyhow  we did blood test which i had to wait under    min    i was alone in the clinic   so not sure why it was so disorganizedtake information from the patient    although we had to repeat the same history that we had done few month before because of system changeall the waiting and lack of follow up on the situation,Negative
a2p4w000002OCHXAA4,0011U00000riioaQAA,doctor is knowledgeable  sonia black   and acutely cares about you and i feel that i can be honest with her none,Negative
a2p4w000002O1ZfAAK,0011U00000ri7mEQAQ,dr  black is great   she quickly got to the cause of my my medical issue   the staff was courteous  amp  professional i called on wednesday            to make an appointment  but had to leave a voice message  i booked the first available appointment for thursday            online   your system made only a    minute appointment  but that was not clear  amp  i thought it was an hour   in spite of the short time  dr  black was able to help me with my medical problem   you should improve your online scheduling to make the duration of appointments clear ,Negative
a2p4w000002OCGtAAO,0014w00002pQNpdAAG,the provider took the time to discuss my health issues   i was able to ask questions and address my concerns without being rushednothing,Negative
a2p4w000002O786AAC,0014w000031qdIvAAI,it was an hour wait past my  pm appointment before my pcr test was taken   when the dr  finally called me to  chat  about my symptoms it was difficult to hear her because of the  chatter  in the background gave me a pcr testmade me wait for an hour ,Negative
a2p3g000000qkiRAAQ,0013g00000KUQ6SAAX,everyone i encountered during my visit was very professional  the medical assistant and provider i was seen by were both very detailed in the questions they asked  and i never once felt like i was being rushed through my visit ,Negative
a2p4w000002NyFSAA0,0013g00000CxSJiAAN,i loved the extra time that all the staff spent with me   everyone is very friendly and made me feel welcome and comfortable you need to update the outside signage   it was a little confusing to find the right building,Negative
a2p4w000002O9qFAAS,0011U000019y5rrQAA,everythingi didn t get a cookie ,Negative
a2p4w000002KK2XAAW,0011U00000ricrGQAQ,don rsquo t usually talk health and do you still need to be a memberthe nurse seemed very green and lacked confidence  struggled with using finger stick and the test equipment showed lack of confidence  during blood draw i shut off look away had no idea she wasn rsquo t filling tubes  didn rsquo t ask to pump fist or release tourniquet  with a fear of doctors and needles and her lack of confidence really was more than i could take ,Negative
a2p4w000002O9e4AAC,0014w00003GEvn2AAD,my appointment had been scheduled for   weeks to have   skin lesions removed  i came from markle area  they were not able to do the procedure as they had no specimen cups in the office did not have specimen containers to send the specimens to the lab,Negative
a2p4w000002O9osAAC,0014w00003GEr5sAAD,i love dr  jordan although i feel since covid it is hard to get in to see her i liked hearing about all of my numbers from the labs and knowing what to adjust in my life to get the numbers better i sat in the parking lot for    minutes waiting to know what to do  i kept calling and no one answered the phone so i didn t know if they even knew if i was there ,Negative
a2p4w000002KKSuAAO,0014w00002pPaz1AAC,dr answered all my questions and seemed to care about what i thoughtapp was a little difficult but wants it worked it went smoothly,Negative
a2p4w000002O1PzAAK,0011U00000riXLgQAM,i was told to call before i came in but no one answered the phone so it rsquo s hard to know what to do with that  that has happened to me two other times  that i was told to call ahead and then no one answers the phone ,Negative
a2p3g000000pzbRAAQ,0011U00000rifuqQAA,fast service  no waitingprompt attention  had called the doctor on sunday with an issue and was able to get the next day perhaps understaffed  had to see a nurse practitioner instead of my regular doctor who was busy all day ,Negative
a2p4w000001pqQVAAY,0011U00000rkAH2QAM,my doctor makes me feel like he really cares about me and my well being  the only draw back for my friends would be the distance from where we live to the office the staff was very friendly  my doctor is very thorough and makes sure i understand my health issues there was nothing that i would say did not go well except drawing blood but that has nothing to do with your staff  i     m just hard to stick     ,Negative
a2p4w000002O7AlAAK,0013g000006th4CAAQ,everything  dr  masterson kindly waited to call me until       my appointment was at    because i m a teacher and wasn t free until then  she listened carefully  asked insightful questions  and supported my decisions about my health care  she took the time to not only listen to my update about my rather complex condition  but also to ask how i was doing otherwise   how my asthma was doing  etc nothing,Negative
a2p4w000002OCQAAA4,0014w000031rXGWAA2,i had an    am appointment  dr  never showed  randomly call me around noon no one showed for my   am appointment i sat on the video line for    minutes and finally hung up  then the doctor randomly called me around noon show up on time,Negative
a2p4w000002OA1hAAG,0014w00003GEIjLAAX,i really liked lindsay and will go back and see her again   she was professional  courteous  and spent time really listening to me  the only drawback is not on her or the staff   just the system and the fact that my medical history was not available in full i really liked lindsay and will go back and see her again   she was professional  courteous  and spent time really listening to me the only drawback is not on her or the staff   just the system and the fact that my medical history was not available in full ,Negative
a2p4w000002O1vlAAC,0014w000031rLnZAAU,cared deeply about me  took the time to know what was wronglupe was a little disorganized  and my appointment got pushed up    minutes without my consent ,Negative
a2p4w000002OEHFAA4,0014w00003GErymAAD,dr  jordan is awesome  we couldn t ask for a better physician  she took the time to fully explain my issues in plain simple language not medical jargon  i was not rushed and i felt good when i left nothing  this should be the model used when setting up future clinics ,Negative
a2p4w000002NyM9AAK,0014w00002pPaPqAAK,difficulty getting an appt  in the next   days  was offered a telehealth visit which i didn     t want or think was appropriate  in the end  they did squeeze me in for a same day appt  in person  which i really appreciated very caring provider   spent lots of time and was genuinely interested in my care just difficulty initially getting an in person vs telehealth visit  do not want telehealth visits ,Negative
a2p4w000002NzXSAA0,0013g000006tejGAAQ,offered helpful advice  was able to offer a prescription to help with both issues on a previous appointment  a different dr failed to give me the same correct advice  meaning treatment for my issue was delayed ,Negative
a2p4w000002OB6iAAG,0014w000031qS0SAAU,the doctor is great but some people that work with him are extremely unprofessionalthe person that took blood from me was very unprofessional and injured my arm,Negative
a2p4w000002O8q4AAC,0014w00002pQNdnAAG,it took three reschedules and a change of doctor to finally complete my appointment doctor was very professional and asked a lot of questions  while informing me of why she was asking   she filled my prescription that i had requested  and provided info on proper use  and things to look out for while using it took three reschedules to actually speak to a doctor  no ones fault really  i m sure it s still just covid craziness  staff was very professional and apologetic when they had to call me ,Negative
a2p4w000002JsWtAAK,0011U00001An2dwQAB,everyone has a doctoreverything is oknurses need to improve their skills in drawing blood,Negative
a2p4w000002O9I8AAK,0014w00003GEYGOAA5,good doctors   nurses talked about my current health with the physician assistant was supposed to be virtual but it was not communicated to the physician  so talked to her on the phone ,Negative
a2p4w000002O9uRAAS,0014w00003GEYGOAA5,dr green was very through  asked us questions pertaining to our health just time waiting to get blood work ,Negative
a2p4w000002NyLLAA0,0011U00000rjTEaQAM,dr  boyer listened to all of my concerns and provided good medical advice that ranged from reading a book on insomnia to providing needed medication courteous and caring staff   a physician that really listened and gave appropriate care   a nurse that held my hand during a painful procedure   i didn     t feel judged by what my issues were either nothing ,Negative
a2p4w000002O3tSAAS,0013g000006temfAAA,prompt response  and layne cryan is so understanding and compassionate  yet to the point  i appreciate that dr  cryan was compassionate and very detailed in her explanation of my mri reports  she helped me understand  what is happening without using too many technical terms nothing,Negative
a2p4w000002ODhvAAG,0014w00003GEEmFAAX,my vitals were checked and adam browning and elizabeth listened to my issues and provided me with the prescription i needed to get better i am not happy that my visits and issues over the past    years or so of coming to this office were not in my file   i needed to recap for all my past visits and medicines   my files should have been updated with everside health from the start of this changeover ,Negative
a2p4w000002O90xAAC,0013g000003owW5AAI,convenient location  friendly associates  no waiting ,Negative
a2p4w000002OCOnAAO,0014w00003GEIW5AAP,i go because it is a michelin clinic and billing is easier   others fellow co workers have their own choices to makedoctor was good  listen well  gave options visit was outside due to it being a respiratory sinus condition  doc did not listen to lungs and did not look inside ears probably because tools were not handy outside,Negative
a2p4w000002O1UuAAK,0011U00000rhrG2QAI,its none of my businessgetting an appointment was fasttook longer than necessary,Negative
a2p4w000002O0wEAAS,0014w00002pQHvzAAG,i waited for over a month to get a call regarding lab results that were abnormal and showed i had an infection  so i have walked around for that amount of time with an infection in my body that could have been easily treated and someone in the office had my results and knew they were abnormal and failed to tell me ,Negative
a2p4w000002O2caAAC,0014w00002pQKSUAA4,dr  culver communicated on a personal level and didn rsquo t talk down like a many physicians do  she took the time to go over things thoroughly and i never felt rushed  she rsquo s an awesome addition to our clinic ,Negative
a2p4w000002OBODAA4,0014w00002pQBwBAAW,dr watkins is great but she has too many patient  they first gave lois a month out appointment for a phone calltoo long to talk to doctor when serious medical advice is needed ,Negative
a2p4w000002KKILAA4,0014w00002pPaROAA0,depends how sick you are   maybe they should be seen in person listened asked the right questionswondered why they asked if i was a smoker ,Negative
a2p4w000002O9KdAAK,0014w000031qjJmAAI,the clinic is nice  friendly staff and not long waiting,Negative
a2p4w000002O54MAAS,0014w00003GE49QAAT,i have only had one experience with them as far as appointments go   i am not very impressed that all of our home clinics  cicero  kokomo  logansport  were closed with very little notice making it very hard to get prescriptions   i had to pay over      for a medication i get free the staff was very friendly and i did not feel rushed at all since my home clinics are closed  i was not able to do a video appointment  rather i had to call in for my appointment since none of my info was in their database ,Negative
a2p4w000002OEGCAA4,0011U00000ri466QAA,the doctor called me  hr late  since i did not have time to talk at that time  we agreed she ll call me later tonight  she never did   still waiting to talk with her nothingeverything,Negative
a2p4w000002ODzaAAG,0014w000031g1oBAAQ,i got in   minutes before my appointment time  nice and courteous an hour and    minutes past my appointment time  i was still there  without having any blood drawn  i believe i should have been done within the hour ,Negative
a2p4w000002O81kAAC,0014w00003GEVfxAAH,everyone was friendly and helpful  but i had to wait awhile to see the nurse practicioner the staff was friendly and helpful i waited for what seemed like a longer than normal amount of time for the nurse practitioner to see me   once she was able to see me  she was kind  professional and helpful ,Negative
a2p4w000002O7MDAA0,0014w00003GEPNwAAP,i had several issues getting registered  when finally registered several issues with making an appointment  staff called stating due to weather a phone visit was necessary  scheduled phone visit  called and left a message it had to be virtual since it was first appt  asked how to log on to virtual appt  but no one could assist  said check for email    min before appt  checked email with no invite  called office  was told she would check and call back  no return call  i just started checking everside site and found an active video button and was able to log on for appt  then told still need to come in to finish  very frustrating and not convenient to take off more work time dr peiffer was very attentive and i did not feel rushed during the appt getting initially registered had many issues  scheduling the correct type of appt was not done   lack of knowledge by staff to access virtual appt ,Negative
a2p4w000002OAvBAAW,0014w00003GEXg5AAH,my concerns were met with compassion and i felt like provider cared about my issueseverythingnothing,Negative
a2p4w000002O7ARAA0,0014w000031rRDBAA2,recommendation that we need to get our  health checkget a complete check,Negative
a2p4w000002O5sbAAC,0011U00000rhv8gQAA,listened to my issues that i am currently having and the encouragement that is giving is great,Negative
a2p3g000000qG2UAAU,0011U00000rjjgiQAA,good servicetime was used properly  no long delays and it seem the medical people on site were not rushedcould not think of any things ,Negative
a2p4w000002O0MpAAK,0011U00000rjrmLQAQ,appointments with no hassle or waitingcalled on time,Negative
a2p4w000002KEmAAAW,0011U00000ri4r6QAA,appointment at       and did not see the dr until     took off of work   i under stand that i was a work in  but this happens a lot weather a work in or pre scheduled was very compassionate and caring   friendly staff took way too long for lack of resolution ,Negative
a2p4w000002O1iDAAS,0011U00000rjgenQAA,i received some print out on some exercises i need to do  that was helpful to have a print out ,Negative
a2p4w000002O71KAAS,0011U00000ri9eoQAA,i shared an on going problem and the doctor was willing to try something new   it helped it was a long physical  so if i had been in a hurry  i was not  it would have bit into my day ,Negative
a2p4w000002OCfeAAG,0014w00003GEVcaAAH,were prepared for the right lab tests that i called in well after scheduling my appointment the new nurse was not a skilled phlebotomist ,Negative
a2p3g000000qGtdAAE,0011U00000rjJwgQAE,quick check in  dawn in monroe office   got me in back to see the doctor quickly  labs taken were quickly done  no waiting   quick results,Negative
a2p3g000000qEz0AAE,0011U00000rjmmZQAQ,dr  mccay was very thorough  timely  and never made me feel like he was in a rush  etc  nursing staff was very friendly ,Negative
a2p4w000002OCWmAAO,0011U00000sgyz0QAA,i really like dr  black  she is thorough and so easy to talk to na,Negative
a2p4w000002O7JEAA0,0014w00003GEFa9AAH,access to my previous patient history was not assessable to the medical team  doctor could not locate what labs were to be rechecked and relied on my feedback at time of labs as to what we were rechecking   arrived   minutes before appt and waited to be called back for    minutes   little to no patients present with more than enough staff staff was pleasant unsure why my wait was so long just for a quick review of a lab recheck   arrived   minutes early and was not called back for    minutes ,Negative
a2p4w000002KK3fAAG,0011U00000ri3frQAA,very thorough and never felt rushednothing,Negative
a2p4w000002O7vXAAS,0011U0000125JoGQAU,all my appointments i never feel rushed and always treated with kindness ,Negative
a2p4w000002O6YIAA0,0014w00003GEF4iAAH,i was only able to select video visit and melanie was accepting in person patients   i am also still waiting for my prescriptions to be sent to cvs pharmacy   visit was on wednesdaymelanie really did a great job explaining all of my test resultsdelay in prescriptions called into my pharmacy,Negative
a2p4w000002K8jUAAS,0011U00000ri8kgQAA,i was fit in for an appointment due to my health concerns  dr  gadmack always take great care of us  nina was exceptional during the entire time and through the blood draws the appointment went great   we are unable to access the portal  that is very important to us  we hope that will change real soon ,Negative
a2p4w000002O8FrAAK,0014w00003GEpk6AAD,blood draw was exceptional       never even felt the draw ,Negative
a2p4w000002ODgsAAG,0014w00003GFxA6AAL,timely manner to get an appointment  and doctor gives time to visit helpful and compassionate care i was a little disappointed about the lack of knowledge of the history and details of my medical issue  i usually expect this and bring details but thought there would be easy access ,Negative
a2p4w000002KGy8AAG,0011U00000rjNzoQAE,good service without rushinggood listening and answers to questions were complete  friendly staff no regular hours  so not sure what hours you are available for any urgent needs ,Negative
a2p4w000002O6EcAAK,0011U00000rj0nMQAQ,got in right away  actually ahead of my appointment  friendly nurse and npn  took his time  listened to me friendly  did not rushpre survey info did not get received so i had to answer all the questions again,Negative
a2p4w000002O0qLAAS,0014w000031qaF2AAI,appt was very good   i never felt pushed or like a number   my questions were all answered and dr  bourgeois really listened to me all went well  from cheerful greeting by the front desk  to my  conversations with the dr   and all tests completed competently ,Negative
a2p3g000000pzbvAAA,0013g000009jwgoAAA,the ease of making an appointment for a telehealth visit was super easy  it was also really easy to fill my prescription through my doctor  thank you the time of my appointment was not kept to the start time but it rsquo s ok  i understand ,Negative
a2p4w000002OCxEAAW,0014w00003GEr9SAAT,it is convenient and easy access time was spent making sure my questions were answered there was nothing done wrong ,Negative
a2p4w000002O0XEAA0,0014w00002pPVAUAA4,took time to explain thingsappt was for         i didn rsquo t leave until       and i was the only patient there the entire time   they spent a lot of time with me but it took way too long   i just wanted an antibiotic   they could have done everything for me in half the time ,Negative
a2p4w000002O2WmAAK,0011U00000rjF4qQAE,my husband joined a number of years before i did  it rsquo s nice to have a regular place to go and continuity of care  however you are  sort of at the mercy of the doctors that are hired by ever side versus the broader choice if you picked your own having recently turned    i feel like the doctor addressed the laundry list of recommendations for my age as well as touched on things that i had been into see him for in the recent past i rsquo m not quite sure what i expected but i do think it rsquo s a little strange to have a physical where the doctor never actually touched me  the nurse took care of blood pressure temperature and weight ,Negative
a2p4w000002OD9PAAW,0014w00003GE4CzAAL,stop sending texts on sunday morning      ,Negative
a2p4w000002O72NAAS,0014w00003GEAyBAAX,the conversion to your company has been a disaster   medical records have  yet to be uploaded  causing the inability to compare previous diagnosis  no correspondence has been to me in regards when this will be corrected  unprofessional have no medical records available  poor planning and slow response from your company  i m sure you will not even address this with me,Negative
a2p4w000002O169AAC,0011U00000rk7lUQAQ,my first doctor threw paldenia was doctor song i haven rsquo t found one i really care at all for since but i will keep lookingmy first ever phone appointment so it rsquo s hard to grade and i have only had my medication       dayssee above and i couldn rsquo t schedule threw the website as offered just did not work,Negative
a2p4w000002OCidAAG,0011U00000rioGXQAY,i messed up my schedule and missed my phone appointment so am unable to comment on this appointment  i have rescheduled for next monday ,Negative
