REVIEW_ID,MEMBER_ID,Reviews,sentiment_label
a2p4w000002O8JoAAK,0014w000031s3OtAAI,the doctor listened to my health concerns  came up with a clear treatment plan and alternatives in case things don t work there was nothing that didn t go well ,Negative
a2p4w000002KKLGAA4,0011U00000rjlJ6QAI,scheduled an appointment within hours of my accident  my other healthcare provided couldn     t see me until about    hours post incident  and i was pretty sure i needed stitches  and received them   np was concerned about my comfort level and did a great job with the stitches at check out  the clerk and i both forgot i needed a follow up appointment to take out the stitches  so i called back to make that appointment after i got home ,Negative
a2p4w000002OClNAAW,0014w000031qGLwAAM,i really felt that this was a one on one appointment  it felt more like  this can take all day  vs we have a half an hr and that s it  i ve never had that experience before at any dr visit  it was also very comfortable i really don t have anything bad to say ,Negative
a2p4w000002OEOfAAO,0014w00003GHWF0AAP,aside from still having to wear a mask for the crappy virus that everybody s not afraid of my appointment was at       i was there at       and didn t get seen until almost    my doctor was able to be very friendly with me she seemed caring and concerned and assured me they would do everything they could to try and figure out what s wrong the receptionist was curt and rude and you re still making people wear masks for no reason at all ,Negative
a2p4w000002NyQkAAK,0014w00002pQ9XGAA0,on time didn     t have to wait longthere was nothing they did wrong,Negative
a2p4w000002OAr4AAG,0011U00000riuhsQAA,i adore the system and love my physician  it is easy for me to schedule and get help quicklylayne  even though she was running behind  she treated me with respect and listened to my issues  discussing several different options and backups plans it was an hour later than the time scheduled  but the physician s assistant had called ahead of time to let me know they were running behind and i know layne had been out sick herself the day before so probably had a lot of appts to make up ,Negative
a2p4w000002O7hpAAC,0014w00003GEeksAAD,thorough  np brought in do for collaboration during appointment   i really appreciated that person rooming me never introduced herself or her role ,Negative
a2p4w000002O9beAAC,0014w00003GEn4RAAT,the blood draw was surprisingly painless   never had such a  good experience  doing something i don t enjoy ,Negative
a2p4w000002O6v7AAC,0014w00002pQKrfAAG,very attentive  went above and beyond addressing my needs and suggesting ways to treat my issues ,Negative
a2p4w000002ODySAAW,0014w00003GGA7MAAX,always very friendly and kind   i am never waiting long for my appointment and all my questions are answered  very thorough i can not think of anything ,Negative
a2p4w000002O9jTAAS,0014w00002pPavpAAC,staff was attentive   positive  caring and listened to what i needed    removed multiple skin tags  without a second thought sent a few for biopsy   that was great  nothing i can think of ,Negative
a2p4w000002O0fhAAC,0011U0000125JhiQAE,i like the fact that i am seen quickly  i hate having an appointment and then getting there on time and waiting another hour again  very timelyhahaha  my veins are deep and so far the nurses have missed my veins on   of   blood draws,Negative
a2p4w000002O6o1AAC,0011U00000ri8zSQAQ,this was my first visit after having a few bad experiences with my last doctor   thus far  i have found this doctor  jeffrey peterson  to be competent  compassionate  and understanding   he appears to take a bit more holistic approach than just  quot here  take pill x for symptom y quot  and actually spent the time necessary to get the whole picture of the issue   i hope this experience is the norm  in which case this rating will easily become a      so far i     m impressed   but having dealt with the us medical industry in recent years  i     m still cautious almost everything   scheduling an appointment without having to wait week s  for an open time slot was good  staff was courteous   doctor listened to my concerns  took good notes and explained things very well   doctor spent more time with me in this one first appointment than i think my prior doctor spent with me in all   of the appointments i had with him before i gave up and decided to give everside a try   they actually read and used understood the forms and information i filled out before the appointment  prior doctor would make me fill out online forms and then fill them out again in office anyway  so in office intake was refreshingly easy quick   appointment started on time and i did not feel like i was being rushed through just to collect a visit fee  unlike last doctor   so far  i     m very glad i bailed on my last doctor and gave dr  peterson a try   my hope is that my initial experience continues initial scheduling was difficult   most online scheduling options resulted in a  quot teleconference only quot  option and i knew an in person visit would be required  would be nice if there were a few more options online or an explanation that the tele visit is free and may result in an in office visit being scheduled  if this is the case   i tried calling the office  but only got voicemail  did not leave message since i was a new patient and that didn     t seem right      when i first arrived  the receptionist nurse tech  not sure her exact role   she seems to do several  was not wearing a mask in accordance with covid health regulations when she came up front   when i asked  she said no one was there and she left her mask at the reception desk and did put it on once she got to it   so i can understand not wanting to wear it if you are healthy and no one is around   this is a bit of a nit pick   but i     m honestly having a hard time coming up with much that wasn     t done well related to this visit ,Negative
a2p4w000002O20MAAS,0014w000031rTKPAA2,not a fan of doctors  never will be explained everything and asked plenty of questions pay your electric bill ,Negative
a2p4w000002ODl9AAG,0014w00003GHTO5AAP,i really appreciate it the follow up call regarding my care as a new member of they took an appropriate amount of time for my initial visit and explained some of the benefits which appear to be useful  my particular health issue however  was not resolved your signage is extremely poor the street marker is unusable as it is damaged twisted dirty and out of orientation  the sign on the front of your facility does not match ever care which is what we thought we were doing business with and most frustrating was your mobile app as numerous problems even though we tried to use it on many different types of platforms it required biometric authorization to continue and one of our phones is not out for that feature and the other phone we choose not to have biometric on it  initially you were hard to contact by phone on my second or third attempt you did return my phone call on a timely manner,Negative
a2p4w000002K2gZAAS,0011U00000rj0eHQAQ,dr furey and her assistant were very receptive and i never felt rushed  i was told dr furey will be leaving your establishment  i will miss her since i had total trust in her and felt she was a truly caring person and had my best interest in mind you are letting this exceptional person leave your establishment   you should do anything you can to keep her since she is a true asset to your company ,Negative
a2p3g000000qkivAAA,0011U00000rjCy7QAE,i pretty much self diagnosed myself  and then they called back with as different plan  so i called back after a voicemail  v and     hrs they got back to me  sorry  but i have better things to do with my timenot knowledgeable,Negative
a2p4w000002O0dMAAS,0011U00000rjcD2QAI,no waiting  the doctor listened and explained everything i asked about  and was courteous and respectful ,Negative
a2p4w000002NzzqAAC,0013g00000HW0lXAAT,everyone is always very friendly  with smiling eyes  since we can rsquo t see mouths   and i love that there rsquo s very little waiting  if any  i don rsquo t agree with measurements of the waist going around the belly  at the belly button   who wears there pants around there belly button hellip  nobody  except    year old men maybe  ,Negative
a2p4w000002O5THAA0,0011U00000rikofQAA,dr  black is wonderful  understanding and caring ,Negative
a2p4w000002OD45AAG,0014w00002pQBwBAAW,it s a pleasure to go to dr watkinsneed to get a post opp  first appointment was after surgery that was not good for a pre opp,Negative
a2p4w000002Nyh2AAC,0014w00002pPb04AAC,dr peterson was friendly and put me at ease for my first visit  he answered any questions i had  i never felt like he was rushed or that my concerns were unimportant   he explained in detail my test results  i rsquo m very likely to recommend dr peterson to my fellow colleagues ,Negative
a2p4w000002Nzl0AAC,0011U00000riSKjQAM,not my primary doctor   you send appointment reminders and give the wrong address for the appointment you sent me to the wrong location ,Negative
a2p4w000002O3GQAA0,0014w000031g1GpAAI,you have to be an aisin employee or a spouse to onelistened to me and my concerns and acted immediately so to not put anything off i waited in the room for awhile before the dr came in,Negative
a2p4w000002ODYPAA4,0014w00003GFvCXAA1,dr  osborne is the best   love her personality   genuine  concern for my health  the details she provides for whatever health issue i have every time i see her   she communicates well with me your front desk clerk ma ignored me as i stood at the window to check in   after a few minutes  a different ma  sitting behind her  finally acknowledged  me and checked me in   the initial  ma ended up being the one who took me to my room and went over my information   it would have been a better experience  if the ma would have communicated what she was doing  where she was taking me  etc   she had a nurse working  with her  attempting to train her  hated the lack of communication ,Negative
a2p4w000002O8dPAAS,0014w00003GEd44AAD,dr  lane is very awesome caring and compassionate  she listens and never makes you feel rushed you did everything well ,Negative
a2p4w000002O2i9AAC,0011U00000rjpBnQAI,dr  black is one of the best providers i     ve had  she explains everything to me  i     m never left wondering why she does what she does  she always cares about my well being and takes time to make sure i feel good about my health plan eeverything was good,Negative
a2p3g000000qcqXAAQ,0011U00000riqQkQAI,i call you friday and you same monday i had a weekend of pain,Negative
a2p4w000002O6MqAAK,0011U00000rhv8gQAA,gave excellent advice and listened to my issues without judging me ,Negative
a2p4w000002OCDkAAO,0011U00000rjcphQAA,the provider listened to my concerns and gave me options to choose from  allowing me to lead my own caremy active status was not reinstated by my appointment time  however  this didn t seem to pose as a barrier to service,Negative
a2p4w000002O7MrAAK,0014w00003GEDrDAAX,i m a new member i haven t had an appointment please refer to number   response ,Negative
a2p4w000002O40sAAC,0011U00000rkCAtQAM,every concern and issue i had was addressed and handled  i never felt hurried everything was very good ,Negative
a2p4w000002OD5rAAG,0014w00003GFIq3AAH,my latest visit was to pick up a prescription iexpected to be able to get to the office early  shortly after opening and pick up my script  when i arrived  no one was there to help me  i went to my vehicle and called and no answer  call return was over   hours later  i love the office staff im sure they were with a patient ,Negative
a2p4w000002O6tVAAS,0014w000031g1j2AAA,service when i am there is good  but it is very difficult to get someone to answer the phone or get a return call when i leave a voicemail  also  getting phone calls back from lab results doesn     t happen everyone seemed very understanding and had my best interest in mind  very knowledgeable and personableeverything during the appointment was very good  just getting an appointment scheduled and return phone calls is the issue,Negative
a2p4w000002O7oMAAS,0014w000031s3E9AAI,very personable and didn t feel hurried  felt like doctor was interested in really understanding what was going on there was no one around at front desk or the desk in back for several minutes,Negative
a2p4w000002NyPhAAK,0013g00000CyYRQAA3,on time  one on one without distratctions  telemedicine on my time to fit my work schedule and no need to leave home  provider was able to prescribe to my preferred pharmacy  provider was great ,Negative
a2p4w000002KKt2AAG,0011U00000rk1MyQAI,respected my time   appointment started on time and was not overly time consuming,Negative
a2p4w000002O2ogAAC,0014w000031qWq2AAE,jennifer william always spends a lot of time with me  i have never had a doctor who seemed to care so much  i love her  i thank god i found her ,Negative
a2p4w000002O74JAAS,0011U00000rk8czQAA,i always feel like my provider takes as much time as i need to answer any questions that i might have  i never feel rushed ,Negative
a2p4w000002O7OEAA0,0011U00000riX9UQAU,the entire appointment was great   i never felt rushed and layne answered all my questions    even with the internet being down the appointment went smooth on my end ,Negative
a2p4w000002O5fwAAC,0014w00002pQM40AAG,nurse was efficient and caring i was not exactly sure where the drive thru was   instructions could have been more clearly explained since there were no signs but that was not a major deal   i just called back for further clarification ,Negative
a2p4w000002KHbyAAG,0011U00000riAuyQAE,honestly everything  from scheduling  to the greeting when i came in  to the np sitting with me everything goes splendidly  i never feel rushed  or that the staff has anywhere else to be when i am with them  going to the doctor can be a chore  but you make it a delight nothing  see previous comment  the paladina everside model works  and works well  thank you ,Negative
a2p4w000002OAy5AAG,0011U00000rjJcmQAE,i always feel as if my concerns are fully addressed and that my dr   dr  sonja black  always gies above and beyond nothing to complain about ,Negative
a2p4w000002O50jAAC,0011U00000rhuJTQAY,i really like dr  demeyere coursey and i also appreciate the small office  limited number of people there at a time and lack of a wait  my biggest complaint is the challenge scheduling an appointment when i have an urgent issue  fortunately this time there was one afternoon of the week with an opening immediately acted to get me an appointment for further evaluation by a radiologist,Negative
a2p4w000002O8EFAA0,0014w000031rQXVAA2,didn t make me wait too longnone,Negative
a2p4w000002O3WOAA0,0011U00000rk9N6QAI,never have to wait long  down to earth staff that really care about you ,Negative
a2p4w000002O12RAAS,0011U00000riPm1QAE,dr snow was very knowledgeable and genuinely cared about my issues ,Negative
a2p4w000002O9YkAAK,0014w00003GEbjVAAT,np cooper   listens  she explains  she will do what she can to solve and maintain her health in her clients  the hours of getting in are broad   however  the hours for the physicians can be limited  they need more part time physicians the front office staff gives out jargon that is part of their profession   without pause   too much when you are sick   slow it down and make sure they  your clients  understand where and what you mean ,Negative
a2p4w000002O4fMAAS,0011U00000rjhxlQAA,quick appointments and knowledgeable staffgot me in the next day  and got in and out in a timely mannerlet a ups driver in without a mask,Negative
a2p4w000002O0pSAAS,0014w000031g14sAAA,pre appointment questionnaire was not sent to the pa i had the appointment with ,Negative
a2p4w000002O9TkAAK,0013g000003oycwAAA,everything   i couldn t be more pleased nothing,Negative
a2p4w000002O1CvAAK,0014w00002pQJjiAAG,great professional treatment and a kind understanding to the patientsa caring and understanding of my issuesnothing that i can say,Negative
a2p4w000002O9QHAA0,0011U00000rjW7NQAU,scored lower than last week because i felt the aide could have tried harder to draw my blood  didn t want to come back for a blood draw explain to me that adam was a little behind  glad to know that my appt may not start on time  but it did my blood didn t get drawn  only tired one time in the right arm  showed staff member that my veins in my right arm is here and little deep  past staff members always using a  butterfly   and there hasn t been any problem until yesterday  didn t want to use the  butterfly   states precious is good with that needle  so have to go back today to see precious ,Negative
a2p4w000002O4hrAAC,0014w000031ra8AAAQ,fantastic service as always   have never had a healthcare team more caring  thoughtful and patient than the team at everside ,Negative
a2p4w000002O8AXAA0,0014w000031g26fAAA,everything from being greeted through the entire appointment   even though the computer system was having some technical difficulties   everyone on the team worked to make the appointment go as smooth as possible nothing,Negative
a2p4w000002KJp4AAG,0011U00000rk6Q3QAI,on time  expressed concern  respectfulthe nurse practitioner  was not very convincing that she knew  much about my health and management of it ,Negative
a2p4w000002O5b1AAC,0011U00000rjYMkQAM,scott was good at listening to what i was experiencing and discussing various options to figure out what is going on nothing ,Negative
a2p4w000002Jp43AAC,0011U00000rj0LEQAY,    being able to share my medical record through www shareeverywhere com     the telehealth microphone and chat bar worked both ways      the telehealth camera allowed me to see my provider     the telehealth video camera did not work to allow my provider to see me      unable to link my centura health account with everside health ,Negative
a2p4w000002NzPnAAK,0011U00000rikWOQAY,scott zellar is always really helpful  knowledgeable  and friendly  scott never rushes and always works hard to help and find answers    jessica drew blood and was friendly  gentle  and kind ,Negative
a2p4w000002O8SHAA0,0014w000031qh1BAAQ,angie frantsi provided the information and care in which i need to continue a healthy lifestyle physically  mentally  and emotionally  thank you    ,Negative
a2p4w000002O7kyAAC,0014w00003GFTWfAAP,everything was great  maybe an email saying to go to the app to connect   i was waiting for some kind of notificationjust the how to connect,Negative
a2p4w000002ODaQAAW,0011U00000rioIKQAY,never get calls back or takes days just to have a prescription sent to the pharmacydidn t call back with results  i was told i d get a call and and a letter emailed for my time needed off work  didn t receive either,Negative
a2p3g000000qohIAAQ,0011U00000ritCAQAY,this is the first provider that i have had that i feel actually listens to me and and truly cares  i never feel stupid or rushed with jenna   georgia is also very kind  understanding and helpful  she is very good at her job ,Negative
a2p4w000002O83gAAC,0014w00002pQEIsAAO,listened to my concerns and prescribed appropriate tests to try to find the root of my discomfort the lab tech had difficulty finding a vein   it took a few tries in my hands ,Negative
a2p4w000002O65VAAS,0014w00003GEBOFAA5,it appears i was properly diagnosed with a rare condition by the nurse practitioner  after discussing the different treatment options we started with the less aggressive non invasive treatment  after one week  we decided to go to the next step in the treatment  it rsquo s only been    hours but i am no longer in pain for the first time in   weeks  extremely pleased ,Negative
a2p4w000002O4jnAAC,0014w00002pPaH1AAK,i need to have more than one person working the front answering the phones checking people in need more people the provider was caring ,Negative
a2p4w000002NyeDAAS,0011U00000rjwhUQAQ,dr friensen really cares and works with her patients to come to the best solution  she asks good questions and doesn     t jump to conclusions on time  good conversation  feel well cared forit challenges  poor dr works through the computer challenges well and without frustration  she clicks on filter to show me specific results but filters don     t work ,Negative
a2p4w000002O8W9AAK,0014w00003GEIHtAAP,not friends with anyone that works at michelin so therefore they won t need to be using the company doctors officenurses taking very good care while trying to draw my blood for blood workhaving to wait past my time to see the dr,Negative
a2p4w000002KKWmAAO,0011U00000rhsjXQAQ,super convenient all around  during the appointment  dr  black was very good about explaining her thinking and making sure i was being heard ,Negative
a2p4w000002O1YhAAK,0011U00000rhrvAQAQ,very professional and comfortable   i have always been so pleased with the attention and care i get with everside paladina  i have been a patient since      ,Negative
a2p4w000002O6irAAC,0011U00000rhs1eQAA,i rsquo m a fat lady  have been since i hit puberty   i intentionally asked the med assistant not to take my weight  she was great and honored my request   i don rsquo t ask for this out of shame  i ask because medical research has consistently shown that intentional weight loss doesn rsquo t work for anyone over the long term between    and     of the time  therefore i rsquo m not interested in a conversation about my weight   the doctor  however  without actually knowing my weight  decided to tell me on two separate visits that i needed to lose weight even though i did not request dieting or exercise advice from her and i insisted i would be consulting a dietician  which i did   even after telling her that i would be consulting a dietitian and without asking me anything about my diet and what i rsquo m actually eating  the doctor told me that i needed to  ldquo stop eating so many carbs  rdquo   my cholesterol level was high  guess what probably caused my high cholesterol  a low carb  high protein diet   would it kill medical professionals to treat fat people with a little respect  we rsquo re told every day of our lives by literally everyone that we are fat and therefore unworthy  weight stigma in the medical profession is why i have  and why many fat people  stay away from doctors for so long that medical problems become untenable  while i may continue going to this doctor for now  i rsquo m seriously considering finding a new one my lab results came back quickly if you rsquo re treating a fat person who has respectfully asked not to be weighed and who has not asked for diet or weight loss advice  please do not provide any  if you want to know what a fat person is eating ask them before making assumptions ,Negative
a2p4w000002OCuPAAW,0011U00000rhu97QAA,it was not an appointment  it was a great conversation with my doctor ,Negative
a2p4w000002O53iAAC,0014w00002pQO85AAG,the staff is always friendly and call me by my name   dr scott is wonderful  she always listens to me about my issues and gives me referrals when needed   she is the most caring doctor i have ever had   my husband feels the same way not anything,Negative
a2p4w000002O6JNAA0,0014w00003GE4FFAA1,i had an appointment to get a refill on my medication that is a controlled drug   atterall    since the clinic has changed from we care to everside  not everything is set up and ready to go   we dealt with not having a clinic for   weeks   then when i went to my appointment yesterday  i was unable to get my medication refilled because my provider does not have  quot access quot  to prescribing at this time with everside   i have been out of my medication for   days now and as a school teacher it is difficult to do my job without it   i was upset that i had to take time away from my classroom to be seen again by a doctor who has seen me numerous times because of t he new system and then i am not able to get my medication and no one can tell me how long it will be until i can get them quickly got me registered into the new system and seen by the npsee previous comment about not being able to get my medication ,Negative
a2p4w000002O8nPAAS,0014w00002pPa0RAAS,appointment was on time   i appreciated going over several health concerns and felt on track to improve my health   i really like michelle and am sad to see her leave  however  she was very reassuring about the team and i look forward to continuing my care with everside they did not tell me what my blood pressure was and i forgot to ask ,Negative
a2p4w000002OCa5AAG,0014w00003GEMdjAAH,i was very  pleased with the care and time that the nurse practitioner spent with me everything was good during my appointment ,Negative
a2p4w000002OCx9AAG,0011U00000rj7oLQAQ,i asked dr  song nichols to review my medical care from the last two years in order to transition to care to her because i was uncomfortable with my previous physician  she and the everside clinical staff have been incredible  and i feel safer  immediately after my initial appointments  i had a bad car accident  my treatments and the follow up provided have been exceptional  i am very glad i made the decision to transition to everside health ,Negative
a2p4w000002OCgXAAW,0011U00000riD6vQAE,dr  black provided relevant and helpful information in a professional and caring manner,Negative
a2p4w000002OAyPAAW,0014w000031qsjvAAA,very little waiting  very efficient ,Negative
a2p4w000002O3GVAA0,0011U00000rjZgCQAU,the staff and doctor were very attentive and courteous   i felt the appointment was extremely positive   the staff and doctor are very knowledgeable   they were very professional   i felt encouraged to continue in my weight loss journey after learning of the positive changes in my overall health examination there was nothing that went wrong ,Negative
a2p4w000002O2SBAA0,0014w000031qN8rAAE,good customer service  on time service forgot to give copy of my electro cardiogram,Negative
