REVIEW_ID,MEMBER_ID,Reviews,sentiment_label
a2p1U000000RoSsQAK,0011U00000rjWSwQAM,dr lee is fantastic  and always a great visit blood draw had to poke  x  while needle was in my arm  wanted me to move my entire arm down so she could better try and find my vein  have had lots of blood draws over the years  and never this bad    ,Negative
a2p1U000000Rou8QAC,0011U00000riql5QAA,they give good servicebeing promptforgot about my request,Negative
a2p1U000000RoIKQA0,0011U00000sgxTlQAI,very complete very caring doctorthe exam room was not,Negative
a2p3g000000Kzo8AAC,0013g000004FctxAAC,dr  fury was superb as far as addressing my issues and coveid compassion and the highest level of care and thoroughness dealing with my situation and followed up nothing negative could be said ,Negative
a2p3g000000ozHVAAY,0013g000006tiIiAAI,doctor beers was able to recognize and fix all of my issues in a fast  professional  caring manner ,Negative
a2p1U000000RpMlQAK,0011U00000rj5XxQAI,doctors are greatengaged in conversation  asked about life and family unable to do x rays in office  that is a huge inconvenience to have to wait for ,Negative
a2p1U000000l8CgQAI,0011U00000rin5JQAQ,the doctor there was very rude  i came there having chest pains and he was more concerned with seeing when i was going to leave my current physician  he also was speaking to me as if my doctor was doing something illegal as far as my meds  several times he asked me what meds i was on  the nurse had already filled in all that information instead of looking at my chart  not once did he check my vitals or anything to see if i was ok and i left that office in tears  i felt like i was a kid being scolded for having a previous doctor that has had my back for over   years  nothing about that visit made me want to come back or even fell better after having pains in my chest and being stressed from work the nurse was sweetthe doctor was completely out of line and did not help or show concern ,Negative
a2p1U000000RobbQAC,0011U00000rimPRQAY,you were able to get me in quickly for an appointment and i always appreciate how dr  gorman spends quality time and does not seem rushed  great care ,Negative
a2p3g000000Kys4AAC,0011U000014s4spQAA,everyone was kind and courteous from the front desk to checking out   timely movement through the appointment  probably the most thorough physical exam i     ve had in    years i wish i would have known that lab services were not going to be available due to the holidays   i would have waited a week to do it all in one trip ,Negative
a2p3g000000KzD9AAK,0011U00000rjuWtQAI,while the convenience is great  two problems linger     dr  malfese referred me to a urologist who then said i needed to see a nephrologist but still charged me for a specialist visit     the general billing confusion with united healthcare makes it difficult to know what i     ve actually paid and what actually to and to whom ,Negative
a2p1U000000RoccQAC,0011U00000rilVCQAY,i never feel rushed or that any issue is off limits   appreciate the care and listening,Negative
a2p3g000000KzqTAAS,0011U00000rjYMKQA2,great program  not affordable or individuals   dr  everett is the best   she knows my whole family and me very well   plus she is kind and empathetic   i call her my friend telemed   worked for      minutes then her connection was dropped and we couldn     t resume it  we had to finish by phone  which wasn     t a bad thing  but the providers need to have adequate tech and internet service ,Negative
a2p3g000000oRd2AAE,0011U00000riNovQAE,the doctor     s expertise and knowledge is extremely valuable to me and assisted me in the direction for treatment i need to be in   i can     t thank  them enough ,Negative
a2p3g000000p00GAAQ,0011U000019xymEQAQ,never heard of it and it doesn rsquo t offer all the same benefits of a larger healthcare provider  it just seemed lower budget overall good care ,Negative
a2p3g000000oeWYAAY,0013g000007a7pAAAQ,i never felt rushed in any way   she is such an extremely good listener  having followed up on a comment i made at a previous appointment ,Negative
a2p3g000000KzvzAAC,0011U00000rjQb0QAE,came in for an allergy shot and they also treated a couple skin issues for me while i was there   removed skin tags there was nothing that did not go well during this appointment  thanks ,Negative
a2p1U000000RoQ7QAK,0011U00000riK5JQAU,received my issues well without dismissing them  were friendly conducted the proper research for my records everything went well at my appointment ,Negative
a2p3g000000pnjsAAA,0011U00000riIi3QAE,i have never had any issues with paladina services  my pcp is always thorough  patient  and really seems to care and all the nurses are kind and helpful i have never had any issues with my appointments ,Negative
a2p1U000000RoWQQA0,0011U00000riE3QQAU,i did not have a good experience  i went to see the doctor because i had a cold and i wanted to find a primary care doctor  as soon as she steps into her office she says   quot how do you end up with our insurance quot  what king of a question is that  anyway  i also wanted to get a referral to see an aye doctor as my eye lids are very dry  she didn     t even bother to check my eyelids  instead she said i needed to see an eye doctor as i may have an infection  so i asked for a referral and she said that they always use the eye doctor at st  anthony     s  that     s was her  quot referral quot   no name given at all  then  we go into some personal questions about my recent labs  i had labs done back in feb      and i told her i could show her anything from my phone as i have a united healthcare app that will show my recent labs and she told me  i needed to make copies of those labs results and bring them in the next time we have an appointment  she said   quot      we are old school here  please make copies yourself quot   that was really an awful experience the front desk employee was courteoussee comments above,Negative
a2p3g000000pEUyAAM,0011U00000rjCQgQAM,paperwork was ready  staff was friendly and helpful  this was for a flu shot  the paperwork took longer  the person that provided the shot was fantastic  i didn     t feel the shot at all na  it was great ,Negative
a2p1U000000Ro92QAC,0011U00000rjnPYQAY,courteous and personable staff no waiting no one else in the waiting room thorough physical and follow upnothing   i am pleased by my experience ,Negative
a2p1U000000Rpt4QAC,0011U00000rjHHOQA2,it     s never rushed  always spend the needed time with each patient  thorough and thoughtful had to r s multiple times due to medical staff scheduling challenges  but that wasn     t too big a deal ,Negative
a2p1U000000RoJ3QAK,0011U00000rjGFBQA2,dr ingram was great  she listened to me  took her time  offered lots of advice  heard my issues  and made me feel comfortable  this is exactly the level of care that i     ve been looking for  with a provider who doesn     t make me feel like i     m just a number  great job by her entire staff nothing ,Negative
a2p1U000000Rp1UQAS,0011U00000rjCsxQAE,easy to set appointments  always seen on time  never feel rushed ,Negative
a2p3g000000Kyo5AAC,0011U00000rifrNQAQ,the staff were able to fit me in the same day for an emergency the dr  was very booked up and was not able to see me at the scheduled time  it was understandable  because i was a same day appt ,Negative
a2p1U000000RoUiQAK,0011U00000ri6QrQAI,don     t know enough  i had to phone several time to get a living breathing person  i absolutely hate press one for etc listen took too long to get in touch with a human,Negative
a2p1U000000Rp5nQAC,0011U00000rjsBMQAY,when blood was drawn i never had any bruising ,Negative
a2p1U000000RpJaQAK,0011U00000rirvzQAA,i have never had a doctor ask as many probing questions and listen to me as much as dr  willis did yesterday  we were able to go over a variety of my concerns and he made sure to address each thoroughly  i was surprised abouti think the cma  maybe rn  that was helping me was being trained because there was another staff in the room that was helping her  i would have been more comfortable if the reason for this additional person was explained to me beforehand  it only became uncomfortable awkward when she began asking me questions about depression anxiety  suggestion  i would have been more comfortable and would have answered more accurately if the mental health assessment was done on a computer ipad so that i could answer them privately  even if someone would read it afterward  it would make me more comfortable in the moment  ,Negative
a2p1U000000RouPQAS,0011U00000riMCSQA2,i arrived    min early before my apt there was no one in the office   i waited til about   after and saw the staff was back   would of liked to of known no one was going to be there when i arrivedhaving polite staffspent less time with me that i would of liked,Negative
a2p1U000000RoddQAC,0011U00000rjf8uQAA,my doctor is uselesseasy to book appointmentevery time i see this doctor it feels like a giant waste of my time,Negative
a2p1U000000RpvkQAC,0011U00000rivbJQAQ,friendly and courteous  the dr  took time to listen to my issues and gave me a good path to follow for relief nothing that i can think of ,Negative
a2p1U000000RptDQAS,0011U00000riXzCQAU,you guys are very accommodating to the patients needs  not long waiting times to see the doctor very friendly and inviting give me info on the what if x ray finds fracture rather than sprain ,Negative
a2p1U000000RvTzQAK,0011U00000rjqmwQAA,staff took the time to handle all my issues and really cared for my needs staff rescheduled my appointment  this was a serious inconvenience  however  it was handled professionally and in a timely manner ,Negative
a2p1U000000RooAQAS,0011U00000rjL8yQAE,everything went well nothing went wrong at the appointment  the internet interface to make the appointment is difficult to navigate ,Negative
a2p3g000000KysCAAS,0011U00000rjTg9QAE,i was greeted nicely and the appointment went quickly i waited    minutes past my scheduled appointment ,Negative
a2p1U000000RoA6QAK,0011U00000rivuFQAQ,very friendly  professional staff  great information both times i     ve had blood draws  two different people  the mas have been terrible at drawing blood  i have excellent veins and never have a problem  the first time i was poked several times and i got painful  this last time i had a huge hematoma after my draw  and still have a bruise  this should be addressed as everything else is great there ,Negative
a2p1U000000RvGHQA0,0011U00000rj06vQAA,number of reasons i feel that my prescriptions don     t get filled on time through my ins due to lack of response from either receptionist or dr  i also it is very hard to get a hold of someone on the phone appt started on time,Negative
a2p1U000000Ro9jQAC,0011U00000rjiGqQAI,not a long wait  easy to make an appointmentthe doctor interaction went well even though i didn     t receive any medications for my possible cold or bad allergies  i was told to purchase sudafed the nurse who checked my blood pressure  temp  etc  had a lack of customer service skills ,Negative
a2p1U000000RpvFQAS,0011U00000rjiGqQAI,slightly unprofessional with the intake process  could use better customer service up front the doctor came in quickly i didn     t have to wait long while in the room the administrator     s computer was extremely slow so the process of checking in took a while  in addition  it also took a while during intake and afterwards getting my prescription ,Negative
a2p3g000000oRfSAAU,0011U00000rjLUOQA2,the pa was defensive when i had to describe to her twice what my previous treatment for a similar infection had been   i had also confirmed my rx location with the admin in the morning  who was very friendly btw  and then when the pa ordered the prescription in ended up on an the entirely opposite side of the denver metro  area the admin who helped me set up the appointment was fabulousthe pa did not listen and then became rude and defensive when i had to explain what my previous treatment was a second time,Negative
a2p3g000000KynbAAC,0011U000011EmVkQAK,everyone was very kind and friendly  from the two girls at the front  to the doctor  to the woman who took my blood  i felt comfortable  the doctor was great  he spent a great deal of time with me and was interested in all i had been through health wise in my past  i felt as if he genuinely cared and that is difficult to find  he called me himself very quickly with my lab results  i also appreciated him suggesting a mammogram d t my family history and his interest in preventative care  i hope everyone there knows how much patients appreciate their kindness everything was great ,Negative
a2p1U000000l8CQQAY,0011U00000rjTTuQAM,the nurse made us feel very uncomfortable   she had two of us in the room for a flu shot  and the person i was in the room with got violated by the nurse unzipping her blouse   it got reported to palidina and the nurse got talked to   she is still there  how do we go there and have  her as our nurse now    it     s like being victimized twice i got a flu shotwe didn     t get treated with dignity and respect,Negative
a2p3g000000pAr5AAE,0011U00000rjuWxQAI,general information on applications such as date  etc already completed for faster service  no waiting  quick and painlessnothing i could see to change,Negative
a2p3g000000KzwbAAC,0011U00000riKrqQAE,everyone is always extremely polite   dr  o     malia is very thorough and never makes me feel rushed ,Negative
a2p1U000000RqEvQAK,0011U00000rjQamQAE,i was highly satisfied with the care given and the time provided to my visit   no waiting was great ,Negative
a2p1U000000RpM5QAK,0011U00000riny9QAA,good service no waiting fast appointment setupexplained and answered my questions let me know what i need to do to stay healthy and what screenings are out there that i should be thinking about getting done,Negative
a2p3g000000oeY5AAI,0011U00000ri2j0QAA,i love paladina and love my doctor even more  i can     t imagine seeing any other dr and i     ve told her she can never leave  ever  but my friends and family are not able to be pts since everyone has different insurance plans  dr  kelly is my favorite doctor of all time  and i     ve seen more drs than i could ever remember  not only did she spend the right amount of time with me  she was able to spend some extra time too  i had a lot on my list to talk to her about  which was accompanied with a ton of questions  and she addressed them all  she always shows genuine care and concern for both my physical and mental health  i     m grateful that i can call anytime and get help with any medical issues i have going on  i sincerely appreciate her and paladina  especially because i don     t have to worry about the cost to my bank account   everything was great  not one complaint ,Negative
a2p3g000000L2PYAA0,0011U00000rjXyuQAE,i was very unhappy with the communication after my last      visit       i drove    miles to be in town and didn     t know it was a virtual call until i was in the car driving to the drs office   then i get a call at       to answer questions before the meeting that was supposed to start at         very unorganized and very poor communication dr asked proper questions  explained diagnosis and what should be done to resolve my issue horrible communication to clarify this was a virtual call and not an actual office visit   also meeting started late ,Negative
a2p3g000000KzIhAAK,0011U000014oeOVQAY,answered question  displayed active listening and compassion  addressed my health concerns and worked out how to best handle themthere was nothing in particular that wasn     t done well,Negative
a2p1U000000l8B9QAI,0011U00000rhuBKQAY,i did not get any benefit from the visit except that wellness point seemed to be the push i got started on timei  had concerns that were not addressed and received a referral to an allergist that my insurance does not require me to get ,Negative
a2p1U000000RoLlQAK,0011U00000rhw2cQAA,not sure about the concept yet and the people and technology don     t seem to be comparable as to appointments and instructionsfixed a problem caused by your appointment systemappointment system,Negative
a2p1U000000RpDSQA0,0011U00000ri7WPQAY,dr  franz spent     hours discussing everything with me   i received a very in depth review of my medical hx and nothing was rushed   also helped work with my prescriptions to save me money ,Negative
a2p3g000000KzKoAAK,0011U00000riS4IQAU,the nurse was very thorough in going over meds  the doctor was very friendly and made me feel so comfortable  she is eager to get my info from the specialists i see so that she is aware of my health issues  she recommended a shingles vaccine and i have never had a doctor do that before absolutely nothing  they were out of the shingles vaccine but said they would call me when they get more  they will schedule me to get it then along with fasting bloodwork ,Negative
a2p1U000000RoA7QAK,0011U00000rjVu8QAE,after several visits of not treating my disorder appropriately including the classic statement of  quot come back to see me if no improvement quot   i lost confidence in this doctor low wait timeafter several visits of not treating my disorder appropriately including the classic statement of  quot come back to see me if no improvement quot   i lost confidence in this doctor ,Negative
a2p1U000000Rp9nQAC,0011U00000ri632QAA,this was my  st visit   need to see if future visits are similar or the same   felt extremely rushed  didn     t feel like i received a  quot complete quot  physical   noticed she had another patient waiting  so this may have been part of the issue   a friend highly recommends dr  hester nurse and doctor were friendly closed sign was up  so i didn     t gain access until about    min  after appointment time   only went in then because i seen someone coming out ,Negative
a2p3g000000LAbkAAG,0011U00000rivbNQAQ,explained everything i need to know  so much so i had no questionshmm i got nothing,Negative
a2p1U000000RqCMQA0,0011U00000rjq1JQAQ,very friendly  professional staffforgot to explain why you needed urine sample,Negative
a2p1U000000RpIjQAK,0011U00000rj9h6QAA,took the time and patience to go over my entire medical history  took time and care to go over my complete med list and helped me to decide what to keep and what to change  didn     t judge me for past mistakes or current changes i need to make and maybe have been too afraid to  did blood work and immunizations and the whole time i felt most at ease i have since i was a kidnothing,Negative
a2p3g000000owKwAAI,0011U00000rjgXFQAY,smooth  honest and open conversations  wasn     t unnecessarily difficult nothing,Negative
a2p3g000000peh9AAA,0011U00000riPFVQA2,everything  asked pertinent questions and listened to what i was saying without assumptions ,Negative
a2p1U000000RqAzQAK,0011U00000rj293QAA,got in right away  kathleen took me straight back to the exam room  didn     t even get to sit down in the waiting room     dr  masterson spent time with me discussing all my concerns   thank you ,Negative
a2p1U000000RoCPQA0,0011U00000riX0sQAE,the doctor     s approach is most welcoming  it     s difficult to find a physician who takes any extra time to learn their patients instead of offering quickly determined solutions everyone explained themselves very clear through the entire visit  there were no shared activity or feelings of rushing or speeding the visit to the end  confirmations where delivered promptly without delay i cannot recall any negative experience ,Negative
a2p3g000000oRdRAAU,0011U00000riqiGQAQ,team and dr  thomas are prompt  respectful and professional  appreciate not waiting endlessly to see the doctor all went well  thank you ,Negative
a2p3g000000pcpfAAA,0011U00000rk9DIQAY,i felt very comfortable with the procedures the staff takes to ensure social distancing  there was no one else in the lobby with me  and mask wearing  they listened and provided a strategy to help me ,Negative
a2p1U000000RoK7QAK,0011U00000rjuA0QAI,long wait  felt unorganized has one of my prescriptions available no one at front to greet  waited    minutes in the lobby  and a pretty common drug  fluoxetine  is not available which i was hoping to receive ,Negative
a2p3g000000pa7qAAA,0011U00000riasYQAQ,listened to my concerns  explained what could possibly be my issues and made great recommendations to check on my issues at hand  dr  joseph also called at the exact time of my appointment and everything dr joseph explained  he was going to do he did do it  and in in a timely manner which is greatly appreciated  but most importantly dr  joseph has always showed concern ,Negative
a2p3g000000KzFiAAK,0011U00000riBIcQAM,spent the time trying to figure out what was going on and why my constant dry cough was occurring  gave me an inhaler which seems to be working  told me i had to eat  which i hadn     t been  never in any hurry and are not in a rush to get you in and out,Negative
a2p1U000000RpI1QAK,0011U00000riyOKQAY,prompt  friendly  caring  i felt like i was listened to i called to make an appointment and never received a call back ,Negative
a2p1U000000RpMEQA0,0011U00000rjretQAA,the level of detail and compassion was not something i was used to   i feel like dr  takas is part of the family from the first appointent ,Negative
a2p1U000000RoyDQAS,0011U00000rjqfFQAQ,listened to my concerns   took time to listen  was not rushed ,Negative
a2p1U000000RvgoQAC,0011U00000rjbGQQAY,not having a  quot i     m the doctor not you and this is what i say and this is the way it goes quot  attitude  no one tried to push pharmaceuticals on me either nothing,Negative
a2p3g000000Kym4AAC,0011U00000rjbyiQAA,this being the first time there  i was not greeted when i walked through the door   i ask do i need to stop at the desk and the lady asked well let     s start with who are you   i didn     t feel the same welcoming that i do at my current office   she never smiled and seemed to not be happy to be at work   i felt more like a burden than a patient i went in as my symptoms appeared as the flu   the doctor checked me and heard my concerns  however i did not get tested for the flu  i advised that i     ve never had the flu and she based it off what i advised    i didnt learn until i took my children to the doctor the same day that there was a test that was done by swabbing the nose   my home never had the flu so i was unaware  i did learn from my children     s doctor that there were   strands that were common that they can test for   my son actually tested for stand b and appeared to have strand a from all the symptoms   i didn     t know if i still have it or not because all i did was go to the doctor to have her confirm my symptoms   i did suggest to check my urine because it was abnormal color for me and it came back fine  i felt that i walked out the with the same question i walked in with  which was do i have the flu   the doctor did have great bedside manner and seemed to care   i just wished the test was performed since i was there for that reason   i assume she made the decision to not test since my symptoms were getting better ,Negative
a2p1U000000RpIWQA0,0011U00000rhxVLQAY,i love how the doctor was able to answer all of my questions  work though possible solutions with me  and took the time to really get to know what i was looking to treat nothing   the entire experience was wonderful   my only regret is waiting so long to try them out ,Negative
a2p1U000000RvUEQA0,0011U00000rijxYQAQ,i feel it     s is difficult to get a appointment in a timely manner the nurse was very friendly and the doctor listened to everything thing i had to say ,Negative
a2p1U000000RouFQAS,0011U00000rigkSQAQ,the care from the nursing engagement to my meeting with dr  mccay was extremely  thorough for a follow up appointment   i can easily say the primary care i receive from paladina health is the best i have every received and i have consistently received quality primary care from previous providers i can     t say this is anything i am displeased about ,Negative
a2p3g000000KzokAAC,0011U00000riosCQAQ,staff went above and beyond to get me connected despite technical difficulties,Negative
a2p3g000000pwySAAQ,0013g000002vIfjAAE,great concept but everything seems very disorganizedwas greeted nicely felt rushed because i came in for a blood pressure check and shingles shot  office was out of the shot and no one called to tell me to reschedule  then they had to  ldquo find rdquo  someone to take my blood pressure  i had an appointment  i shouldn rsquo t have felt like i was in the way ,Negative
a2p3g000000ptXOAAY,0011U00000rjbNiQAI,biometrics and flu shoti wanted the shingles vaccine and let them know in advance and it wasn     t stocked when i got there ,Negative
a2p1U000000RovwQAC,0011U00000riHdYQAU,because they are not in a union of on medicareno waiting  things explained throughly  answered all questionsnothing,Negative
a2p1U000000RoG1QAK,0011U00000rin5eQAA,very friendly staff and good quality carescheduling the appointment was the most frustrating  process,Negative
a2p3g000000p4SmAAI,0011U00000rib9rQAA,front desk was very friendly waiting time is a little too long which might be due to covid ,Negative
a2p1U000000Rv8rQAC,0011U00000riOYOQA2,i like the business model and the staff was really nice listen to my concerns and provided referral where needed i would have been nice for the doc or nurse to take note of my birthday  big    coming up and i forgot to ask     is there anything i need to worry about medically with this milestone ,Negative
a2p1U000000RpGXQA0,0011U00000rjZJwQAM,all of the previous questionsgive me my lab results  still waiting for results  i called and looked on line  no results yet ,Negative
a2p1U000000RpLNQA0,0011U00000rhqufQAA,everything   i always feel respected and never feel rushed ,Negative
